{
  "architecture": {
    "summary": "A small Spring-style service with controller-service-repository layering, a KYC HTTP integration, a risk-scoring service, JPA repository persistence, Kafka event publishing and contract/example documentation.",
    "style": "modular_service",
    "modules": [
      {
        "name": "API layer",
        "responsibility": "Expose onboarding and status REST endpoints.",
        "dependencies": [
          "Application service"
        ],
        "evidence": [
          {
            "path": "src/main/java/com/acme/onboarding/OnboardingController.java",
            "line": 12
          },
          {
            "path": "src/main/java/com/acme/onboarding/OnboardingController.java",
            "line": 21
          }
        ]
      },
      {
        "name": "Application service",
        "responsibility": "Orchestrate duplicate check, KYC, risk scoring, status decision, persistence and event publishing.",
        "dependencies": [
          "CustomerRepository",
          "KycClient",
          "RiskScoringService",
          "OnboardingEventPublisher"
        ],
        "evidence": [
          {
            "path": "src/main/java/com/acme/onboarding/OnboardingService.java",
            "line": 14
          },
          {
            "path": "src/main/java/com/acme/onboarding/OnboardingService.java",
            "line": 23
          }
        ]
      },
      {
        "name": "Domain model",
        "responsibility": "Represent Customer state and state transitions.",
        "dependencies": [],
        "evidence": [
          {
            "path": "src/main/java/com/acme/onboarding/Customer.java",
            "line": 5
          },
          {
            "path": "src/main/java/com/acme/onboarding/CustomerStatus.java",
            "line": 3
          }
        ]
      },
      {
        "name": "Integrations",
        "responsibility": "Call KYC provider and publish Kafka events.",
        "dependencies": [
          "External KYC",
          "Kafka"
        ],
        "evidence": [
          {
            "path": "src/main/java/com/acme/onboarding/KycClient.java",
            "line": 13
          },
          {
            "path": "src/main/java/com/acme/onboarding/OnboardingEventPublisher.java",
            "line": 16
          }
        ]
      }
    ],
    "external_systems": [
      {
        "name": "KYC provider",
        "direction": "outbound",
        "protocol": "HTTP",
        "evidence": [
          {
            "path": "src/main/java/com/acme/onboarding/KycClient.java",
            "line": 13
          }
        ]
      },
      {
        "name": "Kafka",
        "direction": "outbound",
        "protocol": "Kafka",
        "evidence": [
          {
            "path": "src/main/java/com/acme/onboarding/OnboardingEventPublisher.java",
            "line": 16
          }
        ]
      }
    ],
    "data_stores": [
      {
        "name": "Customer database",
        "technology": "JPA",
        "evidence": [
          {
            "path": "src/main/java/com/acme/onboarding/CustomerRepository.java",
            "line": 6
          }
        ]
      }
    ],
    "runtime": [
      {
        "name": "Spring application",
        "description": "Application name and integration settings are configured in application.yml.",
        "evidence": [
          {
            "path": "src/main/resources/application.yml",
            "line": 1
          },
          {
            "path": "src/main/resources/application.yml",
            "line": 3
          }
        ]
      }
    ],
    "target_architecture": {
      "summary": "Keep the current modular service shape, but move volatile business decisions and integration configuration into explicit policies/configured clients before considering a broader platform or service split.",
      "target_style": "modular_monolith",
      "tech_stack_options": [
        {
          "name": "Hardened Spring Boot modular service",
          "fit": "Best fit for the compact repository because REST, validation and JPA dependencies are already Spring-based.",
          "tradeoffs": [
            "Lowest migration effort",
            "Keeps deployment simple",
            "Does not independently scale KYC/risk/eventing components"
          ],
          "evidence": [
            {
              "path": "pom.xml",
              "line": 7
            },
            {
              "path": "pom.xml",
              "line": 9
            }
          ]
        },
        {
          "name": "Split KYC/risk/eventing services",
          "fit": "Potential future option only if independent scaling or ownership boundaries emerge; current evidence does not justify the added operational complexity.",
          "tradeoffs": [
            "Clearer deployable boundaries",
            "Higher CI/CD and observability burden",
            "Requires stronger contract and event governance"
          ],
          "evidence": [
            {
              "path": "src/main/java/com/acme/onboarding/OnboardingService.java",
              "line": 27
            },
            {
              "path": "src/main/java/com/acme/onboarding/OnboardingEventPublisher.java",
              "line": 16
            }
          ]
        }
      ],
      "migration_steps": [
        {
          "order": 1,
          "description": "Inject the configured risk threshold and add boundary tests for scores 70 and 71.",
          "risk": "low",
          "evidence": [
            {
              "path": "src/main/java/com/acme/onboarding/OnboardingService.java",
              "line": 30
            },
            {
              "path": "src/main/resources/application.yml",
              "line": 7
            }
          ]
        },
        {
          "order": 2,
          "description": "Inject and configure the KYC HTTP client with timeout/retry policy.",
          "risk": "low",
          "evidence": [
            {
              "path": "src/main/java/com/acme/onboarding/KycClient.java",
              "line": 9
            },
            {
              "path": "src/main/java/com/acme/onboarding/KycClient.java",
              "line": 13
            }
          ]
        },
        {
          "order": 3,
          "description": "Add CI contract validation for OpenAPI/WSDL examples before larger technology migration work.",
          "risk": "medium",
          "evidence": [
            {
              "path": "src/main/resources/openapi.yaml",
              "line": 1
            },
            {
              "path": "src/main/resources/wsdl/kyc-status.wsdl",
              "line": 1
            }
          ]
        }
      ],
      "open_questions": [
        "Whether KYC, risk scoring or event publishing need separate runtime ownership is not proven by this compact repository."
      ]
    },
    "observations": [
      {
        "title": "Business decision sits in application service",
        "description": "The ACTIVE vs MANUAL_REVIEW decision is implemented in OnboardingService rather than a dedicated policy object.",
        "evidence": [
          {
            "path": "src/main/java/com/acme/onboarding/OnboardingService.java",
            "line": 30
          }
        ]
      }
    ],
    "mermaid": "flowchart TD\n  Client[API Client] --> Controller[OnboardingController]\n  Controller --> Service[OnboardingService]\n  Service --> Repo[CustomerRepository]\n  Service --> KYC[KycClient]\n  Service --> Risk[RiskScoringService]\n  Service --> Kafka[OnboardingEventPublisher]\n  Repo --> DB[(Customer DB)]\n  KYC --> ExternalKYC[External KYC Provider]\n  Kafka --> Topic[(customer.onboarding.started)]"
  },
  "findings": [
    {
      "id": "finding-direct-resttemplate",
      "category": "maintainability",
      "severity": "low",
      "title": "KYC client creates RestTemplate internally",
      "description": "The KYC client constructs RestTemplate directly, which makes configuration and testing less explicit.",
      "recommendation": "Inject an HTTP client bean with timeout and retry policy.",
      "evidence": [
        {
          "path": "src/main/java/com/acme/onboarding/KycClient.java",
          "line": 9
        }
      ]
    }
  ],
  "refactoring": [
    {
      "id": "refactor-risk-policy",
      "title": "Extract onboarding decision policy",
      "description": "Move the ACTIVE/MANUAL_REVIEW decision and threshold into a dedicated policy object or configuration-driven service.",
      "benefit": "Business logic becomes easier to test and change.",
      "risk": "low",
      "effort": "S",
      "candidate_files": [
        "src/main/java/com/acme/onboarding/OnboardingService.java",
        "src/main/java/com/acme/onboarding/RiskScoringService.java",
        "src/main/resources/application.yml"
      ],
      "prerequisites": [
        "Add tests for risk score boundary values"
      ],
      "evidence": [
        {
          "path": "src/main/java/com/acme/onboarding/OnboardingService.java",
          "line": 30
        },
        {
          "path": "src/main/resources/application.yml",
          "line": 7
        }
      ]
    },
    {
      "id": "refactor-kyc-client",
      "title": "Inject KYC HTTP client",
      "description": "Inject RestTemplate or a typed client instead of constructing it inside KycClient.",
      "benefit": "Improves testability and makes timeouts/retries configurable.",
      "risk": "low",
      "effort": "S",
      "candidate_files": [
        "src/main/java/com/acme/onboarding/KycClient.java"
      ],
      "prerequisites": [],
      "evidence": [
        {
          "path": "src/main/java/com/acme/onboarding/KycClient.java",
          "line": 9
        },
        {
          "path": "src/main/java/com/acme/onboarding/KycClient.java",
          "line": 13
        }
      ]
    }
  ],
  "modernization": [
    {
      "id": "modernize-contract-validation",
      "title": "Add contract validation to CI",